[
  {
    "id": "usgs:us7000example",
    "source": "usgs",
    "sourceUrl": "https://earthquake.usgs.gov/earthquakes/eventpage/us7000example",
    "layerId": "earthquake",
    "title": "M 6.2 - 15 km SW of Napa, California",
    "summary": "USGS native point. Public-domain catalog fixture for the weekend map.",
    "occurredAt": "2026-10-03T12:04:11Z",
    "updatedAt": "2026-10-03T12:10:00Z",
    "lng": -122.4,
    "lat": 37.8,
    "altM": -10000,
    "geoPrecision": "point",
    "geoSource": "native",
    "weight": 6.2,
    "significance": 80,
    "entities": [
      {
        "type": "place",
        "text": "Napa",
        "confidence": 0.9
      }
    ],
    "rawRef": "RAW.INGEST_BATCH:usgs-fixture-001"
  },
  {
    "id": "firms:viirs:20261003:napa",
    "source": "firms",
    "sourceUrl": "https://firms.modaps.eosdis.nasa.gov/map/#d:2026-10-03;l:VIIRS_SNPP_NRT;@-122.35,38.55,8z",
    "layerId": "wildfire",
    "title": "VIIRS hotspot cluster north of Napa Valley",
    "summary": "NASA FIRMS native hotspot. Cite NASA FIRMS. Heatmap-first; this row is a marker fixture.",
    "occurredAt": "2026-10-03T11:40:00Z",
    "updatedAt": "2026-10-03T11:55:00Z",
    "lng": -122.35,
    "lat": 38.55,
    "altM": 0,
    "geoPrecision": "point",
    "geoSource": "native",
    "weight": 0.82,
    "significance": 55,
    "entities": [
      {
        "type": "place",
        "text": "Napa Valley",
        "confidence": 0.7
      }
    ],
    "rawRef": "RAW.INGEST_BATCH:firms-fixture-001"
  },
  {
    "id": "gdelt:123",
    "source": "gdelt",
    "sourceUrl": "https://api.gdeltproject.org/api/v2/doc/doc?query=Napa%20earthquake%20smoke&mode=artlist&maxrecords=10&format=json",
    "layerId": "news",
    "title": "Local outlets report shaking and smoke in Napa County",
    "summary": "Curated headline fixture. Coordinates are a city-scale geocode, not a sensor point.",
    "occurredAt": "2026-10-03T13:20:00Z",
    "updatedAt": "2026-10-03T13:22:00Z",
    "lng": -122.2869,
    "lat": 38.2975,
    "altM": null,
    "geoPrecision": "city",
    "geoSource": "google_geocode",
    "weight": 1,
    "significance": 40,
    "entities": [
      {
        "type": "place",
        "text": "Napa County",
        "confidence": 0.86
      },
      {
        "type": "org",
        "text": "local outlets",
        "confidence": 0.4
      }
    ],
    "rawRef": "RAW.INGEST_BATCH:gdelt-fixture-001"
  },
  {
    "id": "societal-demo:north-america:technology",
    "source": "fictional-demo",
    "sourceUrl": null,
    "layerId": "technology",
    "title": "[Demo] San Francisco: Open computing platform launch",
    "summary": "A fictional startup introduces an open computing platform for local businesses. Not a real report.",
    "occurredAt": "2026-10-03T08:00:00Z",
    "updatedAt": "2026-10-03T08:00:00Z",
    "lng": -122.4194,
    "lat": 37.7749,
    "altM": null,
    "geoPrecision": "city",
    "geoSource": "centroid",
    "weight": 1,
    "significance": 96,
    "entities": [
      {
        "type": "place",
        "text": "San Francisco",
        "confidence": 1
      }
    ],
    "rawRef": null
  },
  {
    "id": "societal-demo:north-america:politics",
    "source": "fictional-demo",
    "sourceUrl": null,
    "layerId": "politics",
    "title": "[Demo] Washington: Digital services policy consultation",
    "summary": "A fictional public consultation considers rules for digital public services. Not a real report.",
    "occurredAt": "2026-10-03T08:08:00Z",
    "updatedAt": "2026-10-03T08:08:00Z",
    "lng": -77.0369,
    "lat": 38.9072,
    "altM": null,
    "geoPrecision": "city",
    "geoSource": "centroid",
    "weight": 1,
    "significance": 94,
    "entities": [
      {
        "type": "place",
        "text": "Washington",
        "confidence": 1
      }
    ],
    "rawRef": null
  },
  {
    "id": "societal-demo:north-america:finance",
    "source": "fictional-demo",
    "sourceUrl": null,
    "layerId": "finance",
    "title": "[Demo] New York: Small-business investment initiative",
    "summary": "A fictional investment initiative explores funding for small businesses. Not a real report.",
    "occurredAt": "2026-10-03T08:16:00Z",
    "updatedAt": "2026-10-03T08:16:00Z",
    "lng": -74.006,
    "lat": 40.7128,
    "altM": null,
    "geoPrecision": "city",
    "geoSource": "centroid",
    "weight": 1,
    "significance": 92,
    "entities": [
      {
        "type": "place",
        "text": "New York",
        "confidence": 1
      }
    ],
    "rawRef": null
  },
  {
    "id": "societal-demo:north-america:humanitarian",
    "source": "fictional-demo",
    "sourceUrl": null,
    "layerId": "humanitarian",
    "title": "[Demo] Toronto: Community housing and skills forum",
    "summary": "A fictional community forum discusses housing access and workforce training. Not a real report.",
    "occurredAt": "2026-10-03T08:24:00Z",
    "updatedAt": "2026-10-03T08:24:00Z",
    "lng": -79.3832,
    "lat": 43.6532,
    "altM": null,
    "geoPrecision": "city",
    "geoSource": "centroid",
    "weight": 1,
    "significance": 90,
    "entities": [
      {
        "type": "place",
        "text": "Toronto",
        "confidence": 1
      }
    ],
    "rawRef": null
  },
  {
    "id": "societal-demo:north-america:conflict",
    "source": "fictional-demo",
    "sourceUrl": null,
    "layerId": "conflict",
    "title": "[Demo] Mexico City: Peacebuilding dialogue exercise",
    "summary": "A fictional mediation exercise explores dialogue and civilian support; no real conflict is alleged. Not a real report.",
    "occurredAt": "2026-10-03T08:32:00Z",
    "updatedAt": "2026-10-03T08:32:00Z",
    "lng": -99.1332,
    "lat": 19.4326,
    "altM": null,
    "geoPrecision": "city",
    "geoSource": "centroid",
    "weight": 1,
    "significance": 88,
    "entities": [
      {
        "type": "place",
        "text": "Mexico City",
        "confidence": 1
      }
    ],
    "rawRef": null
  },
  {
    "id": "societal-demo:north-america:news",
    "source": "fictional-demo",
    "sourceUrl": null,
    "layerId": "news",
    "title": "[Demo] Vancouver: Public-interest journalism forum",
    "summary": "A fictional newsroom forum discusses access to reliable local reporting. Not a real report.",
    "occurredAt": "2026-10-03T08:40:00Z",
    "updatedAt": "2026-10-03T08:40:00Z",
    "lng": -123.1207,
    "lat": 49.2827,
    "altM": null,
    "geoPrecision": "city",
    "geoSource": "centroid",
    "weight": 1,
    "significance": 86,
    "entities": [
      {
        "type": "place",
        "text": "Vancouver",
        "confidence": 1
      }
    ],
    "rawRef": null
  },
  {
    "id": "societal-demo:south-america:technology",
    "source": "fictional-demo",
    "sourceUrl": null,
    "layerId": "technology",
    "title": "[Demo] São Paulo: Open computing platform launch",
    "summary": "A fictional startup introduces an open computing platform for local businesses. Not a real report.",
    "occurredAt": "2026-10-03T09:00:00Z",
    "updatedAt": "2026-10-03T09:00:00Z",
    "lng": -46.6333,
    "lat": -23.5505,
    "altM": null,
    "geoPrecision": "city",
    "geoSource": "centroid",
    "weight": 1,
    "significance": 69,
    "entities": [
      {
        "type": "place",
        "text": "São Paulo",
        "confidence": 1
      }
    ],
    "rawRef": null
  },
  {
    "id": "societal-demo:south-america:politics",
    "source": "fictional-demo",
    "sourceUrl": null,
    "layerId": "politics",
    "title": "[Demo] Brasília: Digital services policy consultation",
    "summary": "A fictional public consultation considers rules for digital public services. Not a real report.",
    "occurredAt": "2026-10-03T09:08:00Z",
    "updatedAt": "2026-10-03T09:08:00Z",
    "lng": -47.8828,
    "lat": -15.7939,
    "altM": null,
    "geoPrecision": "city",
    "geoSource": "centroid",
    "weight": 1,
    "significance": 72,
    "entities": [
      {
        "type": "place",
        "text": "Brasília",
        "confidence": 1
      }
    ],
    "rawRef": null
  },
  {
    "id": "societal-demo:south-america:finance",
    "source": "fictional-demo",
    "sourceUrl": null,
    "layerId": "finance",
    "title": "[Demo] Santiago: Small-business investment initiative",
    "summary": "A fictional investment initiative explores funding for small businesses. Not a real report.",
    "occurredAt": "2026-10-03T09:16:00Z",
    "updatedAt": "2026-10-03T09:16:00Z",
    "lng": -70.6693,
    "lat": -33.4489,
    "altM": null,
    "geoPrecision": "city",
    "geoSource": "centroid",
    "weight": 1,
    "significance": 75,
    "entities": [
      {
        "type": "place",
        "text": "Santiago",
        "confidence": 1
      }
    ],
    "rawRef": null
  },
  {
    "id": "societal-demo:south-america:humanitarian",
    "source": "fictional-demo",
    "sourceUrl": null,
    "layerId": "humanitarian",
    "title": "[Demo] Bogotá: Community housing and skills forum",
    "summary": "A fictional community forum discusses housing access and workforce training. Not a real report.",
    "occurredAt": "2026-10-03T09:24:00Z",
    "updatedAt": "2026-10-03T09:24:00Z",
    "lng": -74.0721,
    "lat": 4.711,
    "altM": null,
    "geoPrecision": "city",
    "geoSource": "centroid",
    "weight": 1,
    "significance": 78,
    "entities": [
      {
        "type": "place",
        "text": "Bogotá",
        "confidence": 1
      }
    ],
    "rawRef": null
  },
  {
    "id": "societal-demo:south-america:conflict",
    "source": "fictional-demo",
    "sourceUrl": null,
    "layerId": "conflict",
    "title": "[Demo] Lima: Peacebuilding dialogue exercise",
    "summary": "A fictional mediation exercise explores dialogue and civilian support; no real conflict is alleged. Not a real report.",
    "occurredAt": "2026-10-03T09:32:00Z",
    "updatedAt": "2026-10-03T09:32:00Z",
    "lng": -77.0428,
    "lat": -12.0464,
    "altM": null,
    "geoPrecision": "city",
    "geoSource": "centroid",